"","category","name","price","ratings","no_of_reviews"
"1","Socks","Men's CLSSC Sock (Pack of 5)","£31.49","4.7 out of 5 stars","82"
"2","Socks","(12-Pack) Smart Mens Socks - Breathable Plain, Patterned, & Black Socks Men - Cotton Socks Men Suitable for Work and Casual Wear - Soft, Insulated Mens Ankle Socks with Reinforced Heel & Toe","£6.30","4.5 out of 5 stars","31,251"
"3","Socks","Mens Socks Cushioned Work Socks Walking Socks Womens Crew Athletic Socks for Outdoor Hiking Trainer Running","£10.34","4.6 out of 5 stars","2,218"
"4","Socks","12 Pairs Mens Cotton Rich Sport Socks Work Socks Shoe Size 6-11 (Black)","£0.86","4.2 out of 5 stars","3,791"
"5","Socks","(10-Pack) Plain Mens Socks - Comfortable Charcoal, Navy & Black Socks - Cotton Socks Suitable for Work & Casual Wear - Breathable, Stain Resistant, Durable Smart Dress Sock","£13.74","4.4 out of 5 stars","14,836"
"6","Socks","Men's Solid Cushion Comfort Cotton Crew Socks, Pack of 5 Pairs","£9.99","4.5 out of 5 stars","5,685"
"7","Socks","Mens Socks 6 Pairs, Cushioned Men Women Socks, Anti-Blister, Anti-Odour, Moisture-Wicking, Breathable Cotton Socks for Trainer, Running, Sports, Walking, Working, Cycling, Hiking","£0.83","4.4 out of 5 stars","1,789"
"8","Socks","Mens Socks Wicking Breathable Cushion Comfortable Casual Crew Socks Outdoor Multipack Performance Hiking Trekking Walking Athletic Socks","£8.54","4.3 out of 5 stars","4,776"
"9","Socks","Black Socks for Men in Heel and Toe Style, Men’s Socks Multipack 6-11 UK, Pack of 6 and 12 Pairs","£0.85","4.4 out of 5 stars","10,297"
"10","Socks","Sports Socks (Pack of 6)","£10.82","4.7 out of 5 stars","17,134"
"11","Socks","12 Pairs Mens Socks 9-11 Multipack Colourful Funky Dress Cotton Cool","£2.16","4.6 out of 5 stars","3,268"
"12","Socks","Mens Black Colour Heel and Toe Socks - 12 Pack - Comfortable, Everyday, Cotton Rich Breathable Socks - Mens UK Shoe Size 6-11","£13.32","4.5 out of 5 stars","1,239"
"13","Socks","5 Pairs Womens Cute Dog Patterned Animal Socks Colorful Funny Casual Cotton Novelty Crew Socks Christmas,One Size","£2.22","4.5 out of 5 stars","6,038"
"14","Socks","Bamboo Trainer Socks for Womens and Mens, No Show Ankle Socks Low Cut Invisible Non Slip Liner Socks Multipack Casual Footies for Sneaker Loafers and Boat Shoes","£15.82","4.5 out of 5 stars","745"
"15","Socks","12 Pairs Mens Heavy Duty Work Socks Shoe Size 6-11 Safety/Steel Toe Boot Socks","£16.99","4.5 out of 5 stars","7,307"
"16","Socks","Men's Smart Durable Socks 6 or 10 Pairs Cotton Socks","£2.83","4.5 out of 5 stars","3,734"
"17","Socks","Men's Performance Cotton Cushioned Athletic Crew Socks, 6 Pairs","£21.99","4.5 out of 5 stars","4,909"
"18","Socks","Mens NIKE 3 pair pack white cotton cushioned sport socks, Shoe 8-11, White","£6.99","4.6 out of 5 stars","4,428"
"19","Socks","Men's Sport Performance Socks (6 pair pack)","£1.17","4.0 out of 5 stars","532"
"20","Socks","Trainer Socks Womens 6 Pairs Cushioned Sports Socks for Women Cotton Breathable Cushion Running Socks Ladies Casual Nonslip Ankle Athletic Socks","£10.99","4.7 out of 5 stars","2,620"
"21","Socks","Mens Bamboo Socks - 12 Pairs - Super Soft Anti Bacterial Socks - Black/Assorted Colours - UK Size 6-11","£14.39","4.2 out of 5 stars","1,200"
"22","Socks","Calf Socks (Pack of 12)","£19.16","4.3 out of 5 stars","1,527"
"23","Socks","Men's Socks (Pack of 5)","£1.60","4.6 out of 5 stars","427"
"24","Socks","Mens UA Heatgear Locut Anti-Odor Arch Support Mesh Socks","£9.99","4.7 out of 5 stars","16,265"
"25","Socks","Premium Merino Wool Dress Socks, Thermal, Breathable, Odourless, Men & Women, 3 Pack","£0.83","4.2 out of 5 stars","11,616"
"26","Socks","Thermal WORK Socks with Thick & Warm Cushion for Men Crew Length Black Socks for Winter 10 Pairs","£8.99","4.5 out of 5 stars","4,748"
"27","Socks","Mens 12 Pair Pack Cotton Casual Smart Design Argyle Contrast Heel Thin Stripe Socks (6-11)","£1.80","4.5 out of 5 stars","1,953"
"28","Socks","Bamboo Socks, Super Soft, Antibacterial for Men & Women, 6 Pack","£9.99","4.3 out of 5 stars","11,611"
"29","Socks","Unisex 3 Pack Crew Socks, White, M UK","£8.32","4.3 out of 5 stars","709"
"30","Socks","Ankle Socks (Pack of 6)","£13.95","4.7 out of 5 stars","688"
"31","Socks","Unisex UA Heatgear NS Anti-Odor Arch Support Mesh Socks","£1.16","4.7 out of 5 stars","14,154"
"32","Socks","Unisex Cushioned Sportswear Crew Socks 6 Pairs Crew Socks (pack of 6)","£17.49","4.7 out of 5 stars","920"
"33","Socks","Mens 5 Pack Cotton Socks","£1.75","4.5 out of 5 stars","1,204"
"34","Socks","New Mens 12 Pairs COTTON RICH Plain White Sport Socks UK 6-11 EUR 39-45","£16.29","4.2 out of 5 stars","3,769"
"35","Socks","Men's Fun Dress Socks Colorful Funky Patterned Cotton Crew Socks","£2.72","4.6 out of 5 stars","5,615"
"36","Socks","Mens Socks Wicking Breathable Cushion Comfortable Casual Crew Socks Outdoor Multipack Performance Hiking Trekking Walking Athletic Socks 5/6 Pairs","£10.82","4.3 out of 5 stars","6,507"
"37","Socks","Mens Trainer Socks, Ankle Cushioned Running Socks, Cotton Low Cut Breathable Anti-Blister Socks for Sports Hiking Cycling Walking Multipack 6 Pairs","£3.61","4.5 out of 5 stars","2,034"
"38","Socks","Men's Dress Cool Colorful Fancy Novelty Funny Casual Combed Cotton Crew Socks Pack","£11.60","4.7 out of 5 stars","6,392"
"39","Socks","Running Socks Cushioned Sports Socks for Man Women 6 Pairs Cotton Trainer Socks Breathable and Comfortable Classic Walking Compression Socks","£10.79","4.4 out of 5 stars","145"
"40","Socks","20 Pairs Mens Cotton Rich Sport Socks Work Socks Shoe Size 6-11","£1.80","4.2 out of 5 stars","5,421"
"41","Socks","3PPK Lightweight Crew,Unisex Adult Socks, Pack of 3","£9.32","4.5 out of 5 stars","3,243"
"42","Socks","Men's Ankle Socks 6 Pairs White Socks Trainer Cushion Socks Plain Exercise, Low Cut Cotton Smart Design Athletic Tennis Hiking Jogging Golf Socks for Sports Business School Men & Women","£1.55","4.5 out of 5 stars","1,412"
"43","Socks","Men's 5 Pairs Wicking Breathable Cushion Comfortable Casual Crew Socks Multi Performance Walking Athletic Socks","£11.66","4.7 out of 5 stars","10,772"
"44","Socks","Men's Value Cotton Crew Socks","£14.95","4.4 out of 5 stars","2,641"
"45","Socks","Unisex 3 Stripes Crew Socks (pack of 3)","£1.25","4.6 out of 5 stars","655"
"46","Socks","6 PAIRS NON ELASTIC DIABETIC MENS EASY GRIP LOOSE SOFT TOP RICH COTTON SOCKS UK SIZE 6-11","£8.32","4.3 out of 5 stars","2,375"
"47","Socks","12 Pack Mens Work Socks - Thick Socks Men, Cushioned Padded Sole For Builders, Mechanics, Engineers - Boot Socks For Men, Work Socks For Men 9-12 Heavy Duty, Thick Work Socks Sweat Absorbing","£1.39","4.5 out of 5 stars","6,685"
"48","Socks","Trainer Ankle Socks for Men Women 10 Pairs Sport Low short Socks","£9.16","4.5 out of 5 stars","5,868"
"49","Socks","10 Pairs Womens Socks Cotton Soft Ladies Patterned Stripes and Spotts Socks for Womens Girls, Orange, One Size","£16.66","4.7 out of 5 stars","548"
"50","Socks","Women's Casual Crew Socks, 6 Pairs","£1.39","4.5 out of 5 stars","17,168"
"51","Socks","Unisex 3 Pack Crew Socks","£20.82","4.5 out of 5 stars","651"
"52","Socks","Trainer Socks Men 6 Pairs Ankle Socks Cushioned Sports Socks for Women Cotton Breathable Cushion Mens Running Socks Ladies Casual Nonslip Ankle Athletic Socks","£15.99","4.4 out of 5 stars","448"
"53","Socks","Men's Socks Bigfoot Honeycomb Top Cotton Rich Pack of 6, Size 12-14 uk/46-50 eur","£1.60","4.5 out of 5 stars","785"
"54","Socks","Unisex 3 Pack Crew Socks, Black, L UK","£16.99","4.5 out of 5 stars","436"
"55","Socks","Hippy Go Lucky Box of 6 Odd socks for Ladies - UK 4-8 EUR 37-42","£14.49","4.7 out of 5 stars","330"
"56","Socks","10 Pairs Black Men Socks Reinforced Heavy Duty Work Socks Crew Cushioned Winter Warm 6-12","£1.45","4.3 out of 5 stars","752"
"57","Socks","10 Pairs Men Sport Socks Size 6-11 Thick Cotton Cushion Crew Compression Ankle Large Pack For Under Trainer Blister Armour Black White Colour","£14.13","4.2 out of 5 stars","5,629"
"58","Socks","Womens Thermal Merino Wool Socks Warm Winter Walking Cozy Hiking Long Heavy Comfy welly Socks Thick Crew Work Soft Boot Socks 5 Pairs","£2.36","4.6 out of 5 stars","5,173"
"59","Socks","Bamboo No Show Trainer Socks for Womens and Men - 8 Pairs Non Slip Low Cut Ankle Socks Sneaker Invisible Footies Loafers Casual Boat Shoes","£10.80","4.6 out of 5 stars","2,467"
"60","Socks","Casual Socks (Pack of 6)","£3.60","4.5 out of 5 stars","309"
"61","Socks","(6-Pack) Men’s Socks with HyFresh Odour Protection Technology 6-11 UK, Colour Options, Soft 24hr Dress Socks Mens Socks Ideal for Work and Casual Wear Breathable, Soft, Durable","£9.99","4.4 out of 5 stars","2,554"
"62","Socks","Mens Colorful Fun Dress Socks - Funky Pattern Socks Novelty Smart Design Cotton Casual Calf Socks 6 Pairs","£1.67","4.7 out of 5 stars","1,735"
"63","Socks","10-Pack Crew Socks for Men Women Cushion Unisex Crew Socks, Pack of 10 Pairs","£9.82","4.5 out of 5 stars","565"
"64","Socks","Unisex Bold 3-stripes Cushioned Crew Socks 3 Pairs Socks (pack of 1)","£1.64","4.1 out of 5 stars","41"
"65","Socks","Unisex Quarter Socks (3 Pair Pack)","£8.99","4.5 out of 5 stars","30,422"
"66","Socks","Mens Socks 6 Pairs, Socks Mens Multipack for Work, Walking, Sports, Hiking, Running, Cycling, Breathable Cotton Socks, Cushioned Crew Socks, Anti-Blister, Anti-Odour, Moisture-Wicking","£3.00","4.4 out of 5 stars","413"
"67","Socks","Circorld Mens Socks Wicking Breathable Cushion Crew Socks Men Women Anti-Blister Athletic Socks Multipack for Everyday Wear Running Work Walking Cycling Sports Hiking 5 Pairs 5-8 9-11 12-14","£13.65","4.5 out of 5 stars","504"
"68","Socks","Mens Socks (5 or 10 Pair Pack) by Mat & Vic's Cotton Classic Comfortable Breathable","£2.28","4.6 out of 5 stars","16,227"
"69","Socks","Crew Socks (Pack of 3)","£9.57","4.7 out of 5 stars","154"
"70","Socks","Sports Socks Cushioned Running Socks Trainer Socks for Men Women Cotton Ankle Socks Low Cut Athletic Walking Socks (6 Pairs)","£0.96","4.6 out of 5 stars","3,429"
"71","Socks","MP Hosiery ZombaFlo® 6 Pairs Diabetic Socks for Men NON Elastic Soft Grip Comfortable Tops cotton Rich Colorful Heel and Toe UK Size 6-11","£10.41","4.5 out of 5 stars","263"
"72","Socks","Graduated Compression Socks, 21-26mmHg, Flight Socks, Running, Women & Men","£9.16","4.3 out of 5 stars","9,328"
"73","Socks","Mens Black Extra Wide Big Foot Comfort Fit Diabetic Socks (3 Pair Pack), UK 11-14 (EU 45-49), Black","£0.92","4.4 out of 5 stars","1,535"
"74","Socks","NEW 4 pairs Mens Arctic Comfort ® Thick Thermal Wool Socks High Tog Rating","£11.66","4.5 out of 5 stars","3,548"
"75","Socks","Men's Socks","£2.33","4.6 out of 5 stars","291"
"76","Socks","Thick Thermal Winter Socks – Pack of 3 Pairs – Socks, Thermal Socks, Warm Socks, Thick Socks, Insulated Socks – For Men Women and Kids - Adult Size 6-11 UK, Black, One Size","£9.99","3.7 out of 5 stars","578"
"77","Socks","Women's Cotton Lightly Cushioned Crew Socks, 10 Pairs","£1.25","4.5 out of 5 stars","11,291"
"78","Socks","Unisex Bold 3-stripes Cushioned Crew Socks 3 Pairs Socks","£12.60","2.5 out of 5 stars","3"
"79","Socks","Men's Cushion Quarter Socks (Pack of 3)","£14.40","4.5 out of 5 stars","6,578"
"80","Socks","Merino Wool Thermal Walking Socks for Men & Women Warm Thick Winter Hiking Cushioned Moisture Wicking Boot Socks for Outdoor 4 Pairs","£9.89","4.5 out of 5 stars","1,510"
"81","Socks","Women's Anti-Blister Moisture Wicking Trainer Socks Athletic Ankle Quarter Cushion Compression Socks","£1.65","4.6 out of 5 stars","4,441"
"82","Socks","Running Socks Thick Cushion Ankle Socks Trainer Socks for Men Women Cotton Sports Socks (6 Pairs)","£9.57","4.7 out of 5 stars","6,862"
"83","Socks","Mens Bamboo Seamless Diabetic Socks Soft Top Ankle Socks,6 Pairs Size 6-11 UK","£1.60","4.5 out of 5 stars","2,169"
"84","Socks","Mens Socks Cushioned Ankle Socks Men Sports Socks Ladies Trainer Socks Women Athletic Socks Running Socks (6 Pairs)","£12.49","4.6 out of 5 stars","4,015"
"85","Socks","NAFFIC Women Athletic Socks, Running Hiking Socks Sports Sneaker Socks Outdoor Hiking Climbing Socks No Blister Terry Cushion, Breathable, Moisture Wicking Sport Low Cut Socks 6 pairs","£12.49","4.6 out of 5 stars","1,725"
"86","Socks","3 Pairs Mens Plain Sports Socks Mens Cotton Rich Sports Socks Men Workout Training Hiking Walking Athletic Sports Socks Mens Breathable Comfortable Sports Socks UK 6-11","£14.53","3.9 out of 5 stars","23"
"87","Socks","Mens Cushioned Crew Socks Performance Athletic Walking Sports Socks Moisture Wicking Cotton Casual Mens Socksfor Men Size 6-11, 5 Pairs","£4.84","4.5 out of 5 stars","767"
"88","Socks","Thermal Socks Merino Wool Socks for Men Women, Thick Warm Crew Sock for Work Walking Hiking Running Skiing and Outdoor Sports","£7.45","4.5 out of 5 stars","2,354"
"89","Socks","mens 6 Pack Crew Socks","£2.48","4.7 out of 5 stars","555"
"90","Socks","Athletic Socks Women 6 Pairs Cotton Cushioned Sports Trainer Socks for Womens Breathable Running Socks Low Cut Nonslip Ladies Ankle Socks","£9.91","4.6 out of 5 stars","185"
"91","Socks","6 PAIRS NON ELASTIC DIABETIC MENS EASY GRIP LOOSE SOFT TOP RICH COTTON SOCKS UK SIZE 6-11","£8.32","4.3 out of 5 stars","2,375"
"92","Socks","12 Pack Mens Work Socks - Thick Socks Men, Cushioned Padded Sole For Builders, Mechanics, Engineers - Boot Socks For Men, Work Socks For Men 9-12 Heavy Duty, Thick Work Socks Sweat Absorbing","£1.39","4.5 out of 5 stars","6,685"
"93","Socks","Trainer Ankle Socks for Men Women 10 Pairs Sport Low short Socks","£9.16","4.5 out of 5 stars","5,868"
"94","Socks","10 Pairs Womens Socks Cotton Soft Ladies Patterned Stripes and Spotts Socks for Womens Girls, Orange, One Size","£16.66","4.7 out of 5 stars","548"
"95","Socks","Women's Casual Crew Socks, 6 Pairs","£1.39","4.5 out of 5 stars","17,168"
"96","Socks","Unisex 3 Pack Crew Socks","£20.82","4.5 out of 5 stars","651"
"97","Socks","Trainer Socks Men 6 Pairs Ankle Socks Cushioned Sports Socks for Women Cotton Breathable Cushion Mens Running Socks Ladies Casual Nonslip Ankle Athletic Socks","£15.99","4.4 out of 5 stars","448"
"98","Socks","Men's Socks Bigfoot Honeycomb Top Cotton Rich Pack of 6, Size 12-14 uk/46-50 eur","£1.60","4.5 out of 5 stars","785"
"99","Socks","Unisex 3 Pack Crew Socks, Black, L UK","£16.99","4.5 out of 5 stars","436"
"100","Socks","Hippy Go Lucky Box of 6 Odd socks for Ladies - UK 4-8 EUR 37-42","£14.49","4.7 out of 5 stars","330"
